smartctl 5.43 2012-06-30 r3573 [x86_64-linux-2.6.32-642.el6.x86_64] (local build)
Copyright (C) 2002-12 by Bruce Allen, http://smartmontools.sourceforge.net

/dev/sg3 [cciss_disk_00] [SAT]: Device open changed type from 'sat,auto' to 'sat'
=== START OF INFORMATION SECTION ===
Device Model:     MB4000GEQNH
Serial Number:    K4GSU0ZB
LU WWN Device Id: 5 000cca 25dcad280
Firmware Version: HPG7
User Capacity:    4,000,787,030,016 bytes [4.00 TB]
Sector Sizes:     512 bytes logical, 4096 bytes physical
Device is:        Not in smartctl database [for details use: -P showall]
ATA Version is:   8
ATA Standard is:  ATA-8-ACS revision 6
Local Time is:    Tue Sep 18 17:18:31 2018 CST
SMART support is: Available - device has SMART capability.
SMART support is: Enabled

=== START OF READ SMART DATA SECTION ===
SMART STATUS RETURN: incomplete response, ATA output registers missing
SMART overall-health self-assessment test result: PASSED
Warning: This result is based on an Attribute check.

General SMART Values:
Offline data collection status:  (0x82) Offline data collection activity
                                        was completed without error.
                                        Auto Offline Data Collection: Enabled.
Self-test execution status:      (   0) The previous self-test routine completed
                                        without error or no self-test has ever 
                                        been run.
Total time to complete Offline 
data collection:                (  113) seconds.
Offline data collection
capabilities:                    (0x5b) SMART execute Offline immediate.
                                        Auto Offline data collection on/off support.
                                        Suspend Offline collection upon new
                                        command.
                                        Offline surface scan supported.
                                        Self-test supported.
                                        No Conveyance Self-test supported.
                                        Selective Self-test supported.
SMART capabilities:            (0x0003) Saves SMART data before entering
                                        power-saving mode.
                                        Supports SMART auto save timer.
Error logging capability:        (0x01) Error logging supported.
                                        General Purpose Logging supported.
Short self-test routine 
recommended polling time:        (   2) minutes.
Extended self-test routine
recommended polling time:        ( 571) minutes.
SCT capabilities:              (0x0025) SCT Status supported.
                                        SCT Data Table supported.

SMART Attributes Data Structure revision number: 16
Vendor Specific SMART Attributes with Thresholds:
ID# ATTRIBUTE_NAME          FLAG     VALUE WORST THRESH TYPE      UPDATED  WHEN_FAILED RAW_VALUE
  1 Raw_Read_Error_Rate     0x002f   100   100   016    Pre-fail  Always       -       0
  2 Throughput_Performance  0x0027   137   100   054    Pre-fail  Always       -       105
  3 Spin_Up_Time            0x0023   136   100   024    Pre-fail  Always       -       390 (Average 391)
  5 Reallocated_Sector_Ct   0x0033   100   100   005    Pre-fail  Always       -       0
  7 Seek_Error_Rate         0x002f   100   100   067    Pre-fail  Always       -       0
  8 Seek_Time_Performance   0x0025   128   100   020    Pre-fail  Offline      -       18
  9 Power_On_Hours          0x0032   099   099   000    Old_age   Always       -       12283
 10 Spin_Retry_Count        0x0033   100   100   060    Pre-fail  Always       -       0
180 Unused_Rsvd_Blk_Cnt_Tot 0x002b   100   100   098    Pre-fail  Always       -       0
194 Temperature_Celsius     0x0022   162   142   000    Old_age   Always       -       37 (Min/Max 22/42)
196 Reallocated_Event_Count 0x0033   100   100   000    Pre-fail  Always       -       0

SMART Error Log Version: 1
No Errors Logged

SMART Self-test log structure revision number 1
No self-tests have been logged.  [To run self-tests, use: smartctl -t]


SMART Selective self-test log data structure revision number 1
 SPAN  MIN_LBA  MAX_LBA  CURRENT_TEST_STATUS
    1        0        0  Not_testing
    2        0        0  Not_testing
    3        0        0  Not_testing
    4        0        0  Not_testing
    5        0        0  Not_testing
Selective self-test flags (0x0):
  After scanning selected spans, do NOT read-scan remainder of disk.
If Selective self-test is pending on power-up, resume after 0 minute delay.